title,short_description,publish_time,author,markdown_content,url
"""Ăn Tết gọn, vào việc ngay"" để hoàn thành kế hoạch năm Bính Ngọ","Bính Ngọ được kỳ vọng là năm hoàn thành một loạt siêu dự án trải dài trên cả nước, góp phần đưa đất nước ta trở thành quốc gia phát triển vào năm 2030.",22/02/2026 19:45,Trần Quang Vinh,"""Ăn Tết gọn, vào việc ngay"" để hoàn thành kế hoạch năm Bính Ngọ

Bính Ngọ được kỳ vọng là năm hoàn thành một loạt siêu dự án trải dài trên cả
nước, góp phần đưa đất nước ta trở thành quốc gia phát triển vào năm 2030.

![](https://image.vietstock.vn/2026/02/22/20260222_vietnamplus_ava6.png) Chủ
tịch Tổng Liên đoàn Lao động Việt Nam Nguyễn Đình Khang tặng quà Tết cho công
nhân lao động Công ty cổ phần Phân đạm và Hóa chất Hà Bắc. (Ảnh: Đồng
Thúy/TTXVN)  
---  
  
Kỳ nghỉ Tết Bính Ngọ kéo dài tới 9 ngày và đã đến thời điểm các cơ quan, xí
nghiệp, đơn vị, công trường... ngóng chờ lực lượng lao động trở lại với guồng
máy thường nhật theo tinh thần “ăn Tết gọn, làm việc sớm, vào việc ngay"" trong
Công văn số 01-CV/TW ngày 12/2/2026 của Ban Bí thư về việc tiếp tục thực hiện
Chỉ thị số 55-CT/TW ngày 22/12/2025 của Ban Bí thư về tổ chức Tết Bính Ngọ năm
2026.

Ban Bí thư yêu cầu các cấp ủy, chính quyền, cơ quan, đơn vị thực hiện nghiêm
kỷ luật, kỷ cương hành chính, kỷ luật đảng, không để thời gian nghỉ Tết ảnh
hưởng đến tiến độ thực hiện các nhiệm vụ, đặc biệt là việc thực hiện Nghị
quyết Đại hội XIV của Đảng, chuẩn bị cuộc bầu cử đại biểu Quốc hội khóa XVI và
đại biểu Hội đồng nhân dân các cấp nhiệm kỳ 2026-2031.

Trong năm Ất Tỵ nước ta đã có những thay đổi bước ngoặt về bộ máy, cơ chế,
chính sách như sáp nhập bộ, ngành, tổng cục, vụ, sắp xếp lại bộ máy hành chính
cấp tỉnh, cấp xã, không còn cấp huyện trung gian, đưa khu vực kinh tế tư nhân
thành động lực tăng trưởng mạnh mẽ nhất...

Bính Ngọ là năm đầu của nhiệm kỳ Đại hội Đảng lần thứ XIV với mục tiêu tăng
trưởng GDP đạt 2 con số. Các chính sách có tính bước ngoặt và tầm nhìn xa đã
được đề ra. Nhưng điều quan trọng hơn là việc thực hiện chúng một cách quyết
liệt, hiệu quả.

Bính Ngọ được kỳ vọng là năm hoàn thành một loạt siêu dự án trải dài trên cả
nước, góp phần đưa đất nước ta trở thành quốc gia phát triển vào năm 2030: sân
bay Long Thành, cao tốc Bến Lức-Long Thành, Vành đai 3 Thành phố Hồ Chí Minh,
Vành đai 4 Hà Nội... Trong Công điện số 02/CĐ-TTg ngày 2/1/2026 về tiếp tục
tăng cường, nâng cao hiệu quả công tác quản lý và đẩy nhanh tiến độ hoàn thành
các dự án đầu tư xây dựng, Thủ tướng Chính phủ Phạm Minh Chính đã kêu gọi toàn
thể cán bộ, công chức, người lao động phát huy tinh thần ""vượt nắng, thắng
mưa, không thua bão gió""... để phấn đấu hoàn thành, sớm đưa vào khai thác các
dự án.

Tinh thần ""vượt nắng, thắng mưa"" cũng cần được phát huy tại mọi địa phương, cơ
quan, doanh nghiệp nhằm hoàn thành vượt mức các chỉ tiêu của năm 2026, trong
đó có việc khắc phục tình trạng người lao động, bao gồm cả những công chức,
viên chức, người lao động trong hệ thống chính trị và ở khu vực doanh nghiệp
“nấn ná chơi Xuân,” còn tâm lý ""tháng Giêng là tháng ăn chơi,"" ""đầu năm đủng
đỉnh"" và “lỡ hẹn” với công việc vào những ngày hậu Tết cổ truyền.

Trong nhiều năm qua, thực trạng quen thuộc sau mỗi kỳ nghỉ Tết Nguyên đán là
người lao động chậm quay về với doanh nghiệp. Người lao động ồ ạt nhảy việc
hay trì hoãn trở lại vị trí sản xuất khiến doanh nghiệp gặp khó trong sắp xếp
nhân sự, ảnh hưởng đến các hoạt động kinh doanh của năm mới.

Để khắc phục điều bất cập này, ngay từ trước Tết, Bộ Nội vụ đã dự báo tình
hình và hướng dẫn các địa phương nắm rõ, dự báo chắc diễn biến về người lao
động, thị trường tại các nhà máy, xí nghiệp tại địa phương của mình. Thực hiện
chỉ đạo của Chính phủ, Thủ tướng Chính phủ, Bộ đã hướng dẫn các địa phương
thực hiện đồng bộ các giải pháp để bảo đảm ổn định thị trường.

Thứ nhất, các địa phương thực hiện tốt đề án về phát triển thị trường lao động
theo Quyết định số 176/QĐ-TTg năm 2021 góp phần tăng cường công tác thông tin
về thị trường, tăng cường kết nối cung cầu, góp phần ổn định thị trường lao
động trước, trong và sau Tết.

Thứ hai, các địa phương và doanh nghiệp cần thực hiện tốt chính sách về tiền
lương, thưởng đối với người lao động tại các doanh nghiệp, đặc biệt là khu
công nghiệp, khu chế xuất.

Thứ ba, các nhà máy, xí nghiệp cần thực hiện tốt việc đưa đón người lao động
trước và sau Tết, công bố việc “lì xì” tiền thưởng khi người lao động quay trở
lại nơi làm việc cũ.

![](https://image.vietstock.vn/2026/02/22/20260222_vietnamplus_ava7.png) Đông
đảo đoàn viên, người lao động làm thủ tục lên “Chuyến bay Công đoàn - Xuân
2026” về quê đón Tết Nguyên đán Bính Ngọ 2026. (Ảnh: Thanh Vũ/TTXVN)  
---  
  
Thứ tư, công đoàn các cấp tổ chức nhiều chuyến xe đưa đón người lao động, góp
phần cùng doanh nghiệp ổn định thị trường việc làm.Kinh nghiệm sau Tết Ất Tỵ
2025 cho thấy, khi được doanh nghiệp quan tâm một cách thực chất thì số lao
động quay trở lại tại nhiều địa phương đạt 96%, 97%, thậm chí là 100%, nổi bật
là Hà Nội, Thành phố Hồ Chí Minh, Đồng Nai, Hải Phòng...

Dịp Tết Bính Ngọ 2026, khoảng trên 12 triệu lượt đoàn viên, người lao động và
thân nhân trên cả nước được thụ hưởng các chương trình chăm lo do tổ chức Công
đoàn triển khai. Đặc biệt, Tổng Liên đoàn Lao động Việt Nam tiếp tục phối hợp
với [Vietnam Airlines](https://finance.vietstock.vn/HVN-tong-cong-ty-hang-
khong-viet-nam-ctcp.htm?languageid=1) và Tổng công ty Đường sắt Việt Nam tổ
chức các chuyến bay, chuyến tàu mang tên “Chuyến bay Công đoàn,” “Chuyến tàu
Công đoàn” để hỗ trợ người lao động về quê sum vầy với gia đình và trở lại nhà
máy sau kỳ nghỉ Tết.

Tại Hà Nội, khoảng 60.000 đoàn viên, người lao động có hoàn cảnh khó khăn được
nhận trợ cấp vào dịp Tết, trong đó ưu tiên các đối tượng bị tai nạn lao động,
mắc bệnh nghề nghiệp, bệnh hiểm nghèo, bị giảm thời gian làm việc, bị nợ tiền
lương, tiền thưởng; gia đình chính sách, người dân tộc thiểu số, nhiều năm
chưa có điều kiện về quê đón Tết; đoàn viên, người lao động ở lại đơn vị,
doanh nghiệp để công tác, sản xuất, kinh doanh trong dịp Tết.

Ở Quảng Ninh, nhiều hoạt động chăm lo Tết Bính Ngọ cho công nhân, lao động
được các cơ quan, đơn vị, doanh nghiệp tích cực triển khai, qua đó không chỉ
đảm bảo cho mỗi gia đình vui Xuân, đón Tết đủ đầy, ấm áp, hạnh phúc mà còn góp
phần thu hút, giữ chân người lao động.

Ngành than là một ví dụ. Cùng với việc tổ chức chương trình ""Tết thợ mỏ,"" các
cấp công đoàn của ngành than còn tổ chức tặng quà cho công nhân, lao động có
hoàn cảnh khó khăn, có thành tích đặc biệt trong lao động sản xuất, trao mái
ấm công đoàn... Ngoài mức thưởng Tết chung 10 triệu đồng/người, có 45 đơn vị
bổ sung tiền lương tháng thứ 13 cho 78.000 lao động với tổng số tiền 955 tỷ
đồng. Tổng các khoản chi cho người lao động dịp Tết Bính Ngọ 2026 trong toàn
ngành là 2.452 tỷ đồng.

Theo Liên đoàn Lao động Thành phố Hồ Chí Minh, riêng trong hệ thống Công đoàn
có hơn 2,8 triệu đoàn viên Công đoàn và người lao động được chăm lo Tết Bính
Ngọ 2026 với tổng kinh phí hơn 3.700 tỷ đồng, trong đó, ngân sách tài chính
Công đoàn chi hơn 3.200 tỷ đồng, còn lại là kinh phí vận động từ các cơ quan,
đơn vị, doanh nghiệp...

Thu hút lực lượng lao động trở lại sản xuất đủ và sớm, ngay sau kỳ nghỉ Tết
bằng việc quan tâm đến đời sống của họ cũng là một cách để nâng cao năng lực
đóng góp vào nền kinh tế đất nước từ phía các doanh nghiệp.

Các doanh nghiệp khỏe là nền tảng cốt lõi cho một nền kinh tế vững, đóng vai
trò tạo việc làm, đóng góp ngân sách, thúc đẩy đổi mới sáng tạo và tăng cường
năng lực cạnh tranh quốc gia. Chỉ khi giới doanh nghiệp phát triển bền vững và
thích ứng tốt với thị trường thì nền kinh tế đất nước mới tăng trưởng ổn định.

Trần Quang Vinh

[Vietnamplus](https://www.vietnamplus.vn/an-tet-gon-vao-viec-ngay-de-hoan-
thanh-ke-hoach-nam-binh-ngo-post1094956.vnp)

\- 11:11 22/02/2026

",http://vietstock.vn/2026/02/an-tet-gon-vao-viec-ngay-de-hoan-thanh-ke-hoach-nam-binh-ngo-768-1404522.htm
Sân bay Nội Bài đón lượng khách kỷ lục trong ngày cuối nghỉ Tết Bính Ngọ,Cảng Hàng không quốc tế Nội Bài đón lượng khách chạm mốc kỷ lục mới trong ngày nghỉ cuối cùng của kỳ nghỉ Tết Nguyên đán Bính Ngọ 2026.,22/02/2026 17:45,Việt Hùng,"Sân bay Nội Bài đón lượng khách kỷ lục trong ngày cuối nghỉ Tết Bính Ngọ

Cảng Hàng không quốc tế Nội Bài đón lượng khách chạm mốc kỷ lục mới trong ngày
nghỉ cuối cùng của kỳ nghỉ Tết Nguyên đán Bính Ngọ 2026.

![](https://image.vietstock.vn/2026/02/22/20260222_vietnamplus_ava5.png) Cảng
Hàng không quốc tế Nội Bài chủ động các kịch bản phục vụ sản lượng vận chuyển
tăng cao dịp Tết Nguyên đán Bính Ngọ 2026. (Ảnh: PV/Vietnam+)  
---  
  
Ngày hôm nay (22/2), ngày cuối cùng của kỳ nghỉ lễ Tết Nguyên đán Bính Ngọ
(ngày mùng 6 Tết), Cảng Hàng không quốc tế Nội Bài chính thức chạm mốc sản
lượng kỷ lục khi người dân đồng loạt quay trở lại để bắt đầu nhịp sống và làm
việc thường nhật.

Theo báo cáo của Cảng Hàng không quốc tế Nội Bài, tổng lưu lượng hành khách
đạt 124.546 lượt. Trong đó, có 48.837 lượt khách quốc tế và 75.709 lượt khách
nội địa.

""Đây là sản lượng hành khách cao nhất từ trước đến nay tại Sân bay quốc tế Nội
Bài,"" lãnh đạo Cảng Hàng không quốc tế Nội Bài khẳng định.

Ngoài ra, số lượng chuyến bay trong ngày hôm nay đạt 702 lượt, bao gồm 317
lượt chuyến bay quốc tế và 385 lượt chuyến bay nội địa.

Để ứng phó với lưu lượng khách tăng đột biến, lãnh đạo Sân bay quốc tế Nội Bài
cho biết áp lực tại nhà ga quốc tế được giải tỏa đáng kể nhờ các hạng mục mở
rộng Nhà ga T2 đã đưa vào khai thác từ cuối năm 2025.

Tại Nhà ga T1 đã tối ưu hóa toàn bộ 98 quầy thủ tục hiện có, đồng thời luôn
duy trì các quầy dự phòng tại sảnh A, B, E để sẵn sàng phục vụ các hãng tăng
chuyến hoặc giải tỏa hành khách khi có hiện tượng đông cục bộ.

Cảng Hàng không quốc tế Nội Bài khuyến khích hành khách sử dụng tài khoản định
danh điện tử VNeID cho các chuyến bay nội địa. Tại Nhà ga T2, hệ thống làm thủ
tục hiện đại như: kiosk check-in tự động, hệ thống gửi hành lý tự động, cửa
kiểm soát an ninh tự động và các thiết bị soi chiếu an ninh thông minh giúp
hành khách chủ động thực hiện thủ tục nhanh chóng mà không cần tiếp xúc nhiều,
giảm tối đa thời gian xếp hàng.

Sân bay Nội Bài tiếp tục áp dụng mô hình phối hợp ra quyết định (A-CDM) giúp
tối ưu hóa việc sử dụng cơ sở hạ tầng và cải thiện chỉ số đúng giờ hệ thống
thu phí không dừng (ETC) tiếp tục được vận hành trơn tru tại tất cả các làn
ra/vào, giúp giải tỏa nhanh chóng các phương tiện; tính toán lượng khách tại
các khung giờ cao điểm để bố trí nhân lực và trang thiết bị phù hợp; sẵn sàng
mở tối đa máy soi chiếu an ninh tại các khung giờ cao điểm để giải tỏa hành
khách nhanh nhất. Hệ thống phát thanh tự động bằng AI, hệ thống chỉ đường và
tra cứu thông tin chuyến bay tự động cũng được triển khai để cung cấp thông
tin nhanh chóng, rõ ràng tới hành khách.

Bên cạnh đó, Cảng Hàng không quốc tế Nội Bài phối hợp chặt chẽ với Công an cửa
khẩu, lực lượng cảnh sát giao thông để đảm bảo tối ưu hóa dây chuyền kiểm soát
an ninh, đồng thời đảm bảo an ninh trật tự, phân luồng, điều tiết giao thông
các khu vực sân đỗ ôtô đến các sảnh nhà ga, đảm bảo an toàn giao thông dịp cao
điểm Tết Nguyên đán.

Sân bay lớn nhất miền Bắc này cũng khuyến cáo hành khách đi lại dịp Tết nên sử
dụng các hình thức check-in online như: sinh trắc học trên nền tảng VNeID, lấy
nhận diện sinh trắc khuôn mặt tại quầy, hoặc check-in qua website của hãng,
ứng dụng di động hoặc tại các kiosk check-in tại sân bay; tra cứu thông tin
chuyến bay, màn hình chỉ đường thông minh… để tiết kiệm thời gian.

Hành khách đi chuyến bay quốc tế nên có mặt trước 3 tiếng, chuyến bay nội địa
trước 2 tiếng so với giờ khởi hành; chuẩn bị giấy tờ và hành lý kiểm tra kỹ
giấy tờ tùy thân (căn cước công dân, hộ chiếu) đảm bảo còn hạn sử dụng; chuẩn
bị hành lý đúng quy định về kích thước và trọng lượng của hãng hàng không.

Để giảm áp lực lên nhà ga và sân đỗ ôtô, Sân bay quốc tế Nội Bài khuyến khích
hành khách hạn chế người thân đưa tiễn và ưu tiên sử dụng các phương tiện vận
tải công cộng.

Việt Hùng

[Vietnamplus](https://www.vietnamplus.vn/san-bay-noi-bai-don-luong-khach-ky-
luc-trong-ngay-cuoi-nghi-tet-binh-ngo-post1094937.vnp)

\- 10:00 22/02/2026

",http://vietstock.vn/2026/02/san-bay-noi-bai-don-luong-khach-ky-luc-trong-ngay-cuoi-nghi-tet-binh-ngo-768-1404520.htm
Bộ trưởng Công an Lương Tam Quang tiếp lãnh đạo Tập đoàn Amazon,"Bộ trưởng Lương Tam Quang khẳng định Bộ Công an luôn ủng hộ các nhà đầu tư và doanh nghiệp nước ngoài, trong đó có Amazon, hoạt động an toàn, hiệu quả, ổn định tại Việt Nam.",22/02/2026 16:45,Ngọc Quang-Đoàn Hùng,"Bộ trưởng Công an Lương Tam Quang tiếp lãnh đạo Tập đoàn Amazon

Bộ trưởng Lương Tam Quang khẳng định Bộ Công an luôn ủng hộ các nhà đầu tư và
doanh nghiệp nước ngoài, trong đó có Amazon, hoạt động an toàn, hiệu quả, ổn
định tại Việt Nam.

![](https://image.vietstock.vn/2026/02/22/20260222_vietnamplus_ava3.png) Đại
tướng Lương Tam Quang đánh giá cao chất lượng dịch vụ của Amazon cung ứng tại
thị trường Việt Nam, đặc biệt là dịch vụ điện toán đám mây đóng vai trò quan
trọng, hỗ trợ hiệu quả hoạt động của các doanh nghiệp Việt Nam. (Ảnh: Đoàn
Hùng/TTXVN)  
---  
  
Theo phóng viên TTXVN tại Washington, trong khuôn khổ chuyến công tác của Đoàn
đại biểu cấp cao Việt Nam tới Hoa Kỳ do Tổng Bí thư Tô Lâm dẫn đầu tham dự
cuộc họp khai mạc Hội đồng Hòa bình về Gaza, ngày 19/2, tại Thủ đô Washington
D.C., Đại tướng Lương Tam Quang - Ủy viên Bộ Chính trị, Bộ trưởng Bộ Công an
đã tiếp ông Shannon Kellog - Phó Chủ tịch Tập đoàn Amazon phụ trách Chính sách
công khu vực châu Mỹ.

Tại buổi tiếp, Đại tướng Lương Tam Quang chúc mừng sự phát triển mạnh mẽ, bền
vững của Amazon trên phạm vi toàn cầu; đánh giá cao chất lượng dịch vụ của
Amazon cung ứng tại thị trường Việt Nam, góp phần thúc đẩy hệ sinh thái đổi
mới sáng tạo, khởi nghiệp và chuyển đổi số quốc gia.

Trong đó, dịch vụ điện toán đám mây của Amazon đóng vai trò quan trọng, hỗ trợ
hiệu quả hoạt động của các doanh nghiệp Việt Nam.

Sự thành công của Amazon tại Việt Nam là minh chứng rõ nét cho môi trường kinh
doanh, đầu tư ngày càng cởi mở, thuận lợi, minh bạch và tiềm năng phát triển
dài hạn của nền kinh tế Việt Nam.

Theo Đại tướng Lương Tam Quang, hiện nay, Chính phủ và Bộ Công an Việt Nam
đang nỗ lực xây dựng và hoàn thiện hành lang pháp lý liên quan đến dữ liệu, an
ninh mạng và bảo vệ quyền riêng tư nhằm bảo đảm chủ quyền dữ liệu quốc gia, an
toàn hệ thống thông tin trọng yếu, đồng thời tạo điều kiện thuận lợi cho doanh
nghiệp hoạt động ổn định, lâu dài..

Bộ trưởng Lương Tam Quang khẳng định Bộ Công an luôn ủng hộ các nhà đầu tư và
doanh nghiệp nước ngoài, trong đó có Amazon, hoạt động an toàn, hiệu quả, ổn
định tại Việt Nam trên cơ sở tuân thủ pháp luật Việt Nam và các điều ước quốc
tế mà Việt Nam là thành viên.

![](https://image.vietstock.vn/2026/02/22/20260222_vietnamplus_ava4.png) Bộ
trưởng Lương Tam Quang và ông Shannon Kellog - Phó Chủ tịch Tập đoàn Amazon
phụ trách Chính sách công khu vực châu Mỹ, chụp ảnh lưu niệm. (Ảnh: Đoàn
Hùng/TTXVN)  
---  
  
Bộ Công an sẽ tiếp tục lắng nghe, trao đổi thẳng thắn các ý kiến, kiến nghị
của doanh nghiệp để kịp thời tháo gỡ khó khăn tạo môi trường hợp tác minh
bạch, bền vững.

Bộ trưởng khuyến khích Amazon tiếp tục mở rộng đầu tư tại Việt Nam, tổ chức
các chương trình đào tạo, chuyển giao công nghệ nhằm nâng cao chất lượng nguồn
nhân lực Việt Nam trong các lĩnh vực trí tuệ nhân tạo, an ninh mạng, phân tích
dữ liệu lớn và quản trị hạ tầng số; đồng thời ủng hộ quan hệ hợp tác kinh tế-
thương mại Việt Nam-Hoa Kỳ phát triển lành mạnh, cân bằng, bền vững và mang
lại lợi ích thiết thực cho nhân dân hai nước.

Phát biểu đáp từ, ông Shannon Kellogg trân trọng cảm ơn Bộ Công an Việt Nam đã
ủng hộ hoạt động đầu tư, kinh doanh của Amazon tại Việt Nam thời gian qua;
mong muốn được đồng hành, hiện thực hóa những định hướng phát triển chiến lược
của Việt Nam, trong đó có các mục tiêu phát triển đến năm 2030 và tầm nhìn
2045.

Lãnh đạo Tập đoàn Amazon bày tỏ ấn tượng với những nỗ lực của Chính phủ và Bộ
Công an trong việc xây dựng môi trường pháp lý minh bạch, ổn định, phù hợp với
xu thế phát triển toàn cầu.

Phó Chủ tịch Shannon Kellog khẳng định Amazon coi Việt Nam là một trong những
thị trường trọng điểm tại khu vực châu Á-Thái Bình Dương, cam kết tiếp tục đầu
tư lâu dài, mở rộng các hoạt động cung ứng dịch vụ tại Việt Nam.

Tập đoàn Amazon mong muốn tiếp tục nhận được sự ủng hộ, hướng dẫn và tư vấn
của Bộ Công an cũng như các cơ quan chức năng Việt Nam trong thời gian tới.

Ngọc Quang-Đoàn Hùng

[Vietnamplus](https://www.vietnamplus.vn/bo-truong-cong-an-luong-tam-quang-
tiep-lanh-dao-tap-doan-amazon-post1094927.vnp)

\- 07:27 22/02/2026

",http://vietstock.vn/2026/02/bo-truong-cong-an-luong-tam-quang-tiep-lanh-dao-tap-doan-amazon-768-1404517.htm
