title,short_description,publish_time,author,markdown_content,url
ĐẨY MẠNH ĐỐI NGOẠI TOÀN DIỆN Ở TẦM CAO MỚI,"(Chinhphu.vn) - Cổng Thông tin điện tử Chính phủ trân trọng giới thiệu bài viết của Tổng Bí thư Tô Lâm với tiêu đề: ""ĐẨY MẠNH ĐỐI NGOẠI TOÀN DIỆN Ở TẦM CAO MỚI"".",18/02/2026 21:00,,"ĐẨY MẠNH ĐỐI NGOẠI TOÀN DIỆN Ở TẦM CAO MỚI

(Chinhphu.vn) - Cổng Thông tin điện tử Chính phủ trân trọng giới thiệu bài
viết của Tổng Bí thư Tô Lâm với tiêu đề: ""ĐẨY MẠNH ĐỐI NGOẠI TOÀN DIỆN Ở TẦM
CAO MỚI"".

![](https://image.vietstock.vn/2026/02/18/1802-tbt-to-lam.jpeg) _Tổng Bí thư
Tô Lâm: Đối ngoại toàn diện ở tầm cao mới phải lấy bản lĩnh, trí tuệ là la bàn
định hướng; tin cậy, trách nhiệm là cầu nối hợp tác; hòa hiếu, luật pháp là
nơi neo đậu giá trị_  
---  
  
Nhìn lại lịch sử cách mạng Việt Nam, vận hội của đất nước luôn gắn liền với
những biến chuyển của thời đại. Ngay sau khi giành được độc lập, Chủ tịch Hồ
Chí Minh đã nói  _""sau vấn đề phòng thủ, ngoại giao là một vấn đề cần yếu cho
một nước độc lập"",_ khẳng định mạnh mẽ vai trò và trách nhiệm của đối ngoại
đối với quốc gia, dân tộc.

Đại hội XIV của Đảng là mốc son lịch sử, mở ra cánh cửa bước vào kỷ nguyên mới
của dân tộc. Dưới ánh sáng của Đại hội XIV, đối ngoại - một nhiệm vụ trọng
yếu, thường xuyên - sẽ được triển khai toàn diện ở tầm cao mới, nhịp đập của
Việt Nam hòa cùng nhịp đập của thế giới, thở cùng hơi thở của thời đại, kiến
tạo hòa bình, bồi đắp thịnh vượng và xây dựng vị thế cao hơn, vững chắc hơn
cho đất nước, cho dân tộc.

Việt Nam trước ngưỡng cửa của thời đại

Thế giới đang đang chứng kiến những chuyển dịch nhanh, cường độ mạnh, tác động
sâu rộng, mang tính thời đại. Các xu hướng vận động đan xen, trái chiều nhau,
vừa gắn kết, phụ thuộc lẫn nhau sâu hơn nhưng cũng vừa chia rẽ, cạnh tranh
mạnh hơn. Nhân loại bước vào một giai đoạn tiềm ẩn những rủi ro nhưng cũng mở
ra nhiều cơ hội phát triển mới. Không một quốc gia nào, dù lớn hay nhỏ, dù
phát triển hay đang phát triển, có thể đứng ngoài sự vận động của thời cuộc.

Một mặt, hệ thống quan hệ quốc tế đa phương và luật pháp quốc tế bị xói mòn,
tranh chấp chủ quyền, xung đột lãnh thổ gia tăng. Cạnh tranh chính trị, kinh
tế đi đôi với giành quyền kiểm soát công nghệ, năng lượng và hạ tầng chiến
lược. Các thách thức an ninh truyền thống và phi truyền thống ngày càng gay
gắt cả về quy mô lẫn tính chất. Mặt khác, những xu thế, trào lưu đương đại về
hòa bình, hợp tác và phát triển, tăng trưởng bền vững, bao trùm và toàn cầu
hóa vẫn tiếp diễn. Cộng đồng quốc tế đa số đều mong muốn kiến tạo một trật tự
thế giới dân chủ, công bằng, bình đẳng, dựa trên luật pháp quốc tế. Cuộc cách
mạng khoa học công nghệ đang mở ra không gian phát triển vô tận dựa trên tri
thức và tiềm năng con người.

Đại hội Đại biểu toàn quốc lần thứ XIV của Đảng đánh dấu kỷ nguyên mới của Dân
tộc Việt Nam sau 96 năm dưới sự lãnh đạo của Đảng, 80 năm giành được độc lập
và 40 năm tiến hành công cuộc đổi mới. Tiếp sau kỷ nguyên độc lập, tự do, xây
dựng chủ nghĩa xã hội và kỷ nguyên đổi mới, đất nước bắt đầu bước vào kỷ
nguyên phát triển phồn vinh, văn minh, hạnh phúc, sánh vai với các cường quốc
năm châu.

![](https://image.vietstock.vn/2026/02/18/1802-viet-nam.png) _Trong thế giới
ngày nay, an ninh và phát triển của mỗi quốc gia không thể biệt lập, đứng bên
ngoài những tác động của thế giới và thời đại, của thời cuộc và cục diện._  
---  
  
Giai đoạn thực hiện Nghị quyết Đại hội XIV của Đảng (2026-2031) là giai đoạn
bản lề, có tính quyết định việc bứt phá trở thành nước phát triển, thu nhập
cao, trình độ tiên tiến. Hoặc sẽ lặp lại bài học mắc kẹt trong bẫy thu nhập
trung bình khi nhiều điểm nghẽn có tính cấu trúc trong mô hình phát triển và
quản trị quốc gia dần bộc lộ. Lịch sử cho thấy trong thời kỳ quá độ giữa cái
cũ và cái mới, nếu không kịp thời bắt nhịp với thế giới và xu thế của thời
đại, nguy cơ tụt hậu sẽ hiện hữu hơn bao giờ hết.

Đẩy mạnh đối ngoại toàn diện ở tầm cao mới

""Hội tụ"" yêu cầu của thời đại và đòi hỏi của đất nước, việc hiện thực hóa hai
mục tiêu chiến lược 100 năm là cam kết chính trị - lịch sử của Đảng trước nhân
dân và cộng đồng quốc tế. Lịch sử nhân loại đã chứng minh: quốc gia nào có sự
chủ động chiến lược, nắm bắt sức mạnh thời đại để gia tăng nội lực thì sẽ
thành công. Trong chiều dài của lịch sử nhân loại, thực tiễn thế giới cho thấy
quy luật nhất quán: không một quốc gia phát triển hùng mạnh nào mà không xây
dựng một nền đối ngoại mạnh. Trong thế giới ngày nay, an ninh và phát triển
của mỗi quốc gia không thể biệt lập, đứng bên ngoài những tác động của thế
giới và thời đại, của thời cuộc và cục diện.

Đứng trước những thời khắc lịch sử, đất nước cần có những quyết sách lịch sử.
Kỷ nguyên mới đòi hỏi phải triển khai _""đối ngoại toàn diện ở tầm cao
mới"":__Bảo đảm cao nhất lợi ích quốc gia dân tộc; lấy hòa bình, độc lập, tự
chủ, tự cường là nền tảng; đặt người dân là trung tâm của mọi chính sách; coi
đóng góp cho cộng đồng quốc tế là trách nhiệm._ Ở tầm cao mới, đối ngoại sẽ
được triển khai một cách tự tin, tự chủ, tự lực, tự cường hơn; đóng góp hiệu
quả hơn vào những mục tiêu chiến lược của đất nước; thể hiện trách nhiệm lớn
hơn đối với hòa bình và phát triển của thế giới.

Đó là nền đối ngoại  _toàn diện ở tầm cao mới về mục tiêu_. Mọi hoạt động đối
ngoại đều hướng đến mục tiêu bảo đảm cao nhất lợi ích quốc gia - dân tộc, vì
Đảng vững mạnh, vì nước Việt Nam giàu mạnh, vì ấm no, hạnh phúc của nhân dân;
hội nhập sâu rộng và có vị trí, vai trò quan trọng trong nền chính trị thế
giới, nền kinh tế toàn cầu và nền văn minh nhân loại, đóng góp vào hòa bình,
ổn định, công bằng, tiến bộ xã hội và sự phát triển phồn vinh của các dân tộc
trong khu vực và trên thế giới.

Đó là nền đối ngoại  _toàn diện ở tầm cao mới về lĩnh vực_. Đối ngoại không
phải là lĩnh vực riêng rẽ mà gắn kết chặt chẽ giữa đối ngoại với quốc phòng,
an ninh, kinh tế, khoa học, công nghệ và văn hóa, xã hội, tạo sức mạnh tổng
hợp phục vụ công cuộc xây dựng và bảo vệ Tổ quốc. Đường lối đối ngoại toàn
diện đặt phát triển kinh tế - xã hội làm trọng tâm, coi ngoại giao phục vụ
phát triển và hội nhập quốc tế là nhiệm vụ trọng yếu, thường xuyên.

Đó là nền đối ngoại  _toàn diện ở tầm cao mới về chủ thể_. Đối ngoại toàn diện
là sự nghiệp của toàn Đảng, toàn dân, phát huy vai trò của cả ba kênh đối
ngoại: đối ngoại Đảng, ngoại giao Nhà nước, đối ngoại Nhân dân, đồng thời huy
động sự tham gia của đối ngoại Quốc hội, các bộ, ban, ngành và địa phương;
giữa đối ngoại với quốc phòng, an ninh và giữa ngoại giao chính trị với ngoại
giao kinh tế, văn hóa, khoa học, công nghệ…

![](https://image.vietstock.vn/2026/02/18/1802-kinh-te-vn.jpg) _Con đường hòa
bình, độc lập, tự chủ, tự cường không chỉ để xây dựng một đất nước giàu mạnh
cho nhân dân mình mà còn để đóng góp có trách nhiệm cho hòa bình, ổn định của
khu vực và trật tự thế giới dựa trên luật pháp_  
---  
  
Triển khai nhiệm vụ ""trọng yếu, thường xuyên"" của đối ngoại

Đối ngoại toàn diện ở tầm cao mới là sự kết hợp giữa kế thừa và phát triển.
Đối ngoại tiếp tục kiên định: đường lối độc lập, tự chủ, tự cường, hòa bình,
hữu nghị, hợp tác và phát triển, đa phương hóa, đa dạng hóa quan hệ đối ngoại;
là bạn, là đối tác tin cậy, là thành viên có trách nhiệm trong cộng đồng quốc
tế. Đồng thời nền đối ngoại Việt Nam tiếp tục phát triển, tiếp thu những tinh
hoa, tri thức và phương pháp của ngoại giao hiện đại, thấm nhuần tinh thần
_""dĩ bất biến ứng vạn biến""_. Con đường hòa bình, độc lập, tự chủ, tự cường
không chỉ để xây dựng một đất nước giàu mạnh cho nhân dân mình mà còn để đóng
góp có trách nhiệm cho hòa bình, ổn định của khu vực và trật tự thế giới dựa
trên luật pháp. Đó là  _kim chỉ nam, là nền tảng đạo lý và là nguyên tắc cơ
bản_ để chúng ta xây dựng các mối quan hệ đối ngoại bền vững.

Đồng thời đối ngoại toàn diện phát triển lên một tầm cao mới, trong đó  _đối
ngoại và hội nhập quốc tế phải là nhiệm vụ ""trọng yếu, thường xuyên""_. Đây là
bước phát triển quan trọng về tư duy, theo đó đối ngoại, hội nhập quốc tế là
một trong những nhiệm vụ chủ yếu, có tầm quan trọng hàng đầu; đồng thời phải
được tiến hành thường xuyên, yêu cầu tính chủ động, nhạy bén, kịp thời và hiệu
quả cao. Tư tưởng đó đặt đối ngoại ở một vị trí trung tâm, với trách nhiệm và
vai trò cao hơn đối với an ninh và phát triển của đất nước:  _Giữ vững hòa
bình để ổn định, ổn định để phát triển, phát triển để nâng cao sức mạnh tổng
thể của đất nước_. Theo đó, đối ngoại toàn diện ở tầm cao mới sẽ triển khai
những nhiệm vụ trọng yếu, thường xuyên theo các hướng sau:

_Thứ nhất, đối ngoại phát huy vai trò tiên phong, thực hiện nhiệm vụ trọng
yếu, thường xuyên trong việc tạo lập cục diện quốc tế thuận lợi cho đất nước_.
Thế giới càng biến động, việc củng cố hòa bình, ổn định cho đất nước càng có
vai trò trọng yếu, then chốt. Đối ngoại phải có sự ""chủ động chiến lược"" trong
mọi tình huống, giữ cho _""trong ấm, ngoài êm""_ : giữ ổn định, phát triển ở bên
trong, giữ hòa bình, hợp tác với bên ngoài. Cùng với quốc phòng, an ninh, đối
ngoại kiên quyết, kiên trì bảo vệ vững chắc độc lập, chủ quyền, thống nhất,
toàn vẹn lãnh thổ của Tổ quốc; bảo vệ Đảng, Nhà nước, Nhân dân và chế độ xã
hội chủ nghĩa; bảo vệ sự nghiệp đổi mới, công nghiệp hóa, hiện đại hóa; bảo vệ
lợi ích quốc gia, dân tộc; bảo vệ an ninh chính trị, trật tự, an toàn xã hội
và nền văn hóa; giữ vững ổn định chính trị và môi trường hòa bình để xây dựng,
phát triển đất nước theo định hướng xã hội chủ nghĩa. Đồng thời thúc đẩy giải
quyết các khác biệt bằng biện pháp hòa bình, trên cơ sở luật pháp quốc tế và
Hiến chương Liên Hợp Quốc.

![](https://image.vietstock.vn/2026/02/18/2802-viet-nam-hoa-binh.jpg) Việt Nam
luôn đóng góp có trách nhiệm cho hòa bình, ổn định của khu vực và trật tự thế
giới dựa trên luật pháp  
---  
  
_Thứ hai, đối ngoại là động lực tạo dựng các điều kiện thuận lợi, tranh thủ
nguồn lực bên ngoài và mở ra không gian phát triển mới cho đất nước_. Thế giới
được định hình bởi các xu hướng mới, những quốc gia thành công là những nước
chủ động nắm bắt, đi trước, đặt mình vào dòng chảy thời đại. Nhiệm vụ của đối
ngoại là nhận diện, tranh thủ cơ hội từ những xu hướng đang định hình kinh tế
thế giới hiện nay như đổi mới sáng tạo, chuyển đổi số, trí tuệ nhân tạo, lượng
tử, tự động hóa...; chuyển hóa được quan hệ tốt đẹp về chính trị thành những
kết quả cụ thể về kinh tế, có thể đo đếm và lan tỏa trực tiếp đến người dân
thông qua các thỏa thuận kinh tế, hiệp định thương mại và đầu tư, hỗ trợ doanh
nghiệp Việt Nam vươn ra thế giới, tham gia sâu hơn vào chuỗi cung ứng khu vực,
toàn cầu.

_Thứ ba, đối ngoại thể hiện tinh thần trách nhiệm cao đối với cộng đồng quốc
tế, đóng góp vào xây dựng và bảo vệ trật tự quốc tế công bằng, bình đẳng dựa
trên luật pháp quốc tế_. Trong một thế giới toàn cầu hóa, lợi ích của quốc gia
- dân tộc, của công dân, doanh nghiệp Việt Nam không chỉ nằm trong đường biên
giới lãnh thổ. Bảo vệ lợi ích quốc gia dân tộc Việt Nam gắn liền với việc bảo
vệ trật tự thế giới công bằng, bình đẳng, dựa trên luật pháp quốc tế. Thế và
lực mới cho phép chúng ta đóng góp tích cực, trách nhiệm đối với các vấn đề
chung của thế giới. Như Chủ tịch Hồ Chí Minh đã từng nói _""Mình đã hưởng cái
hay của người thì phải có cái hay cho người ta hưởng""_ , Việt Nam sẽ tiếp tục
các cam kết của mình về phát triển bền vững, an ninh lương thực, biến đổi khí
hậu, giảm phát thải ròng; đồng thời tham gia sâu hơn vào các hoạt động gìn giữ
hòa bình, cứu hộ cứu nạn, viện trợ nhân đạo, trung gian hòa giải và phát huy
vai trò nòng cốt, dẫn dắt trong những vấn đề và cơ chế quan trọng, phù hợp.

_Thứ tư, phát huy ""sức mạnh mềm"" của dân tộc tương xứng với tầm vóc lịch sử và
văn hóa, vị thế chính trị và kinh tế của đất nước_. Vị thế, uy tín đất nước
không chỉ nằm ở sức mạnh vật chất mà còn là ""sức mạnh mềm"". Đó là lịch sử hào
hùng, nền văn hóa đậm đà bản sắc dân tộc, những thành tựu to lớn, có ý nghĩa
lịch sử của công cuộc đổi mới, là đường lối đối ngoại hòa bình, hòa hiếu, xử
lý các vấn đề quốc tế hài hòa, có lý, có tình, tôn trọng luật pháp quốc tế, là
sự đồng tình, ủng hộ của nhân dân thế giới. Ở tầm cao mới, đối ngoại phải góp
phần gia tăng vị thế, ảnh hưởng của đất nước trong nền chính trị thế giới,
kinh tế toàn cầu và văn minh nhân loại.

_Thứ năm, xây dựng nền đối ngoại và ngoại giao toàn diện, hiện đại, chuyên
nghiệp._ Kỷ nguyên mới đòi hỏi xây dựng nền đối ngoại ngang tầm khu vực và
vươn tầm quốc tế. Các cán bộ đối ngoại, ngoại giao phải dám nghĩ, dám làm, dám
đổi mới sáng tạo, dám tiên phong, đột phá vì lợi ích quốc gia – dân tộc; nhạy
bén về thời thế, sâu sắc về chiến lược, có kỷ luật, kỷ cương và có kỹ năng,
trình độ ngang tầm quốc tế. Đối ngoại toàn diện không chỉ là nhiệm vụ của một
bộ, một ngành mà là sự nghiệp của toàn dân, của cả hệ thống chính trị để tạo
sức mạnh tổng hợp.

Trước những biến động của thời cuộc, đối ngoại toàn diện ở tầm cao mới phải
lấy  _bản lĩnh, trí tuệ là la bàn định hướng; tin cậy, trách nhiệm là cầu nối
hợp tác; hòa hiếu, luật pháp là nơi neo đậu giá trị_. Chúng ta tin tưởng rằng
đối ngoại Việt Nam sẽ tiếp tục tạo lập và gìn giữ hòa bình, ổn định, mở rộng
không gian phát triển và nâng tầm vị thế đất nước, góp phần hoàn thành di
nguyện thiêng liêng của Bác Hồ:  _""Điều mong muốn cuối cùng của tôi là: Toàn
Đảng, toàn dân ta đoàn kết phấn đấu, xây dựng một nước Việt Nam hoà bình,
thống nhất, độc lập, dân chủ và giàu mạnh, và góp phần xứng đáng vào sự nghiệp
cách mạng thế giới""./._

[Báo chính phủ](https://baochinhphu.vn/day-manh-doi-ngoai-toan-dien-o-tam-cao-
moi-102260217150954013.htm)

\- 19:58 18/02/2026

",http://vietstock.vn/2026/02/day-manh-doi-ngoai-toan-dien-o-tam-cao-moi-761-1404447.htm
