title,short_description,publish_time,author,markdown_content,url
KDI đặt mục tiêu tăng chất lượng vận hành đa ngành,"Tập đoàn KDI định hướng tập trung nâng cao chất lượng vận hành, tạo dòng tiền bền vững từ du lịch - dịch vụ, tăng giá trị sử dụng của sản phẩm trong năm 2026.","Thứ ba, 24/2/2026, 15:00 (GMT+7)",Hoài Phương,"Sau kỳ nghỉ Tết Bính Ngọ, Tập đoàn KDI và Công ty cổ phần Vega City có buổi
tiếp và làm việc với lãnh đạo tỉnh Khánh Hòa do ông Lữ Thanh Hải - Ủy viên Ban
thường vụ Tỉnh ủy, Phó chủ tịch HĐND tỉnh dẫn đầu.

Tại buổi làm việc, đại diện doanh nghiệp cho biết khu vực Nha Trang, Khánh Hòa
tiếp tục là địa bàn đầu tư trọng điểm trong chiến lược dài hạn. Doanh nghiệp
định hướng tập trung nâng cao hiệu quả vận hành các dự án hiện hữu, gia tăng
giá trị khai thác thực tế và đóng góp ngân sách ổn định.

![Lãnh đạo tỉnh Khánh Hòa thăm và làm việc cùng đại diện Tập đoàn KDI và Công
ty Cổ phần Vega City. Ảnh:
KDI](data:image/gif;base64,R0lGODlhAQABAAAAACH5BAEKAAEALAAAAAABAAEAAAICTAEAOw==)

Lãnh đạo tỉnh Khánh Hòa thăm và làm việc cùng đại diện Tập đoàn KDI và Công ty
Cổ phần Vega City. Ảnh: _KDI_

Hai dự án Champarama Resort & Spa và Vega City Nha Trang (tên thương mại
Libera Nha Trang) đang được triển khai. Năm 2025, Vega City ghi nhận doanh thu
1.015 tỷ đồng; tổng tài sản 11.783 tỷ đồng. Doanh nghiệp nộp ngân sách 940 tỷ
đồng. Các dự án đón gần 84.000 lượt khách lưu trú. Thu nhập bình quân người
lao động đạt 26 triệu đồng mỗi tháng.

Trong dịp Tết Nguyên đán 2026, Libera Nha Trang đón hơn 20.000 lượt khách tham
gia các hoạt động lễ hội. Nhà hát Đó vận hành từ mùng 2 Tết với tối đa 3 suất
diễn mỗi ngày. Chương trình nghệ thuật ""Rối Mơ"" đạt tỷ lệ lấp đầy trên 80%
trong tuần diễn Tết; ""Chum"" đạt hơn 50%. Tổng lượng khách xem show tăng hơn
150% so với cùng kỳ năm trước.

![Dự án Libera Nha Trang hút hàng nghìn khách dịp Tết. Ảnh:
KDI](data:image/gif;base64,R0lGODlhAQABAAAAACH5BAEKAAEALAAAAAABAAEAAAICTAEAOw==)

Dự án Libera Nha Trang hút hàng nghìn khách dịp Tết. Ảnh: _KDI_

Ngoài bất động sản - du lịch, các đơn vị thành viên triển khai kế hoạch năm
mới trên nhiều lĩnh vực.

Trong giáo dục, KDI & KDC Education cho biết tiếp tục tập trung vào các chương
trình STEM và kỹ năng công dân số. Trung tâm trải nghiệm khoa học công nghệ
STEM Town hoạt động trở lại từ mùng 4 Tết.

![Trẻ em tìm hiểu về khoa học tại STEM
Town.](data:image/gif;base64,R0lGODlhAQABAAAAACH5BAEKAAEALAAAAAABAAEAAAICTAEAOw==)

Trẻ em tìm hiểu về khoa học tại STEM Town. Ảnh: _KDI_

Tại Đăk Lăk, KD Green Farm tổ chức sản xuất đầu năm, duy trì hoạt động tại các
nông trường và nhà xưởng.

Theo đại diện doanh nghiệp, năm 2026 KDI ưu tiên xây dựng chiến lược đầu tư
dựa trên ba trụ cột: hiệu quả tài chính, giá trị xã hội và khả năng phát triển
bền vững. Đơn vị hướng đến tăng chất lượng sản phẩm, dịch vụ ở tất cả các lĩnh
vực.

**Hoài Phương**

",https://vnexpress.net/kdi-dat-muc-tieu-tang-chat-luong-van-hanh-da-nganh-5043551.html
"Phòng khô mắt, tránh giảm thị lực","Khám mắt định kỳ, mang kính râm khi ra ngoài nắng, uống đủ nước và tránh tiếp xúc với khói thuốc có thể phòng khô mắt, giữ đôi mắt khỏe mạnh.","Thứ ba, 24/2/2026, 15:00 (GMT+7)",Khám mắt định kỳ,"Khô mắt là tình trạng mắt không sản xuất đủ nước mắt hoặc nước mắt bốc hơi quá
nhanh, khiến bề mặt nhãn cầu không được bôi trơn đầy đủ. Triệu chứng thường
gặp gồm đỏ mắt, nhìn mờ, cảm giác cộm xốn, khó chịu và nhạy cảm với ánh sáng.
Nếu không điều trị, khô mắt có thể ảnh hưởng đến sinh hoạt hằng ngày cũng như
gây tình trạng nhìn mờ, giảm chất lượng thị giác.

Khô mắt có thể xảy ra ở bất kỳ ai, song nguy cơ cao hơn ở người trên 50 tuổi
do khả năng tiết nước mắt suy giảm theo thời gian. Phụ nữ cũng dễ gặp hơn vì
thay đổi nội tiết trong thai kỳ, mãn kinh hoặc khi dùng thuốc tránh thai.
Người mắc bệnh lý nền như viêm khớp dạng thấp, đái tháo đường, bệnh tuyến
giáp, lupus, hội chứng Sjögren... cũng có nguy cơ cao.

Dưới đây là 9 biện pháp giúp phòng ngừa tình trạng này.

**Khám mắt định kỳ**

Khám mắt thường xuyên, đặc biệt ở người lớn tuổi, giúp phát hiện sớm tình
trạng khô mắt. Các xét nghiệm như soi đèn khe hoặc đo thời gian vỡ màng phim
nước mắt (tear break-up time) có thể đánh giá số lượng và chất lượng nước mắt.
Người lớn nên khám mắt định kỳ toàn diện 1-2 năm một lần, trẻ em và người cao
tuổi (60 tuổi trở lên) nên khám hàng năm để theo dõi các bệnh liên quan đến
tuổi tác.

**Lưu ý tác dụng phụ của thuốc**

Một số thuốc như thuốc kháng histamine, thuốc thông mũi, thuốc điều trị tăng
huyết áp và thuốc chống trầm cảm có thể làm giảm tiết nước mắt. Nếu nghi ngờ
thuốc đang dùng gây khô mắt, hãy trao đổi với bác sĩ điều trị trước khi điều
chỉnh hoặc ngừng thuốc.

**Mang kính râm khi ra ngoài nắng**

Ánh sáng mặt trời, gió và ánh sáng mạnh có thể làm tăng bốc hơi [nước
mắt](https://vnexpress.net/nuoc-mat-co-bao-gio-het-khong-4963914.html). Nên sử
dụng kính râm tối màu, ôm sát để bảo vệ mắt cũng như duy trì độ ẩm bề mặt nhãn
cầu.

**Hạn chế các yếu tố môi trường bất lợi**

Tránh tiếp xúc với khói thuốc, khói lửa trại và môi trường nhiều gió hoặc hanh
khô. Trong điều kiện thời tiết khắc nghiệt, bạn nên ở trong nhà hoặc sử dụng
kính bảo hộ.

**Sử dụng máy tạo ẩm**

Không khí khô do điều hòa hoặc hệ thống sưởi có thể làm khô mắt. Máy tạo ẩm
giúp tăng độ ẩm không khí, hỗ trợ duy trì sự ổn định của màng phim nước mắt.

**Uống nhiều nước**

Bổ sung đủ nước có thể duy trì cân bằng dịch trong cơ thể và hỗ trợ quá trình
sản xuất nước mắt. Người trưởng thành khỏe mạnh nên bổ sung 1,8-2 lít nước mỗi
ngày.

**Ngủ đủ giấc**

Người trưởng thành cần khoảng 7-9 giờ ngủ mỗi đêm. Thiếu ngủ hoặc ngủ gián
đoạn làm giảm chất lượng nước mắt, trầm trọng thêm [triệu chứng khô
mắt](https://vnexpress.net/7-dau-hieu-canh-bao-hoi-chung-kho-
mat-5005462.html).

**Hạn chế thời gian sử dụng thiết bị điện tử**

Sử dụng máy tính, điện thoại hoặc tivi kéo dài khiến tần suất chớp mắt giảm.
Chớp mắt giúp phân bố nước mắt đều trên bề mặt giác mạc. Áp dụng quy tắc
20-20-20, tức cứ 20 phút, nhìn xa 20 feet (khoảng 6 mét) trong 20 giây để thư
giãn cơ mắt, giảm mỏi và khô mắt.

**Tuân thủ điều trị**

Người bị khô mắt cần tuân thủ phác đồ điều trị như sử dụng nước mắt nhân tạo
hoặc thuốc theo chỉ định của bác sĩ. Nếu triệu chứng không giảm, người bệnh
nên tái khám để được đánh giá và cân nhắc các biện pháp can thiệp phù hợp.

**Bảo Bảo** (Theo _Health_)

Độc giả gửi câu hỏi về bệnh nhãn khoa [tại đây](https://vnexpress.net/suc-
khoe/cac-benh/nhan-khoa/hoi-dap) để bác sĩ giải đáp  
---

",https://vnexpress.net/phong-kho-mat-tranh-giam-thi-luc-5043406.html
Fesco tăng gần 20% công suất vận chuyển trên tuyến Ấn Độ - Nga,"Tập đoàn Vận tải Fesco của Nga tăng công suất trên tuyến Fesco Indian Line West (FIL-W), củng cố mạng lưới vận chuyển container giữa cảng Novorossiysk với Ấn Độ, Trung Đông và khu vực Biển Đỏ.","Thứ ba, 24/2/2026, 15:00 (GMT+7)",Hải My,"Động thái này được thực hiện sau khi doanh nghiệp triển khai một tàu có tải
trọng lớn hơn thay thế cho một tàu nhỏ trước đó trên vòng tuyến. Con tàu mới
hiện thực hiện chuyến đi đầu tiên từ Jebel Ali (UAE) tới Novorossiysk, chở
hàng nhập khẩu.

![Các container của Fesco. Ảnh:
Fesco](data:image/gif;base64,R0lGODlhAQABAAAAACH5BAEKAAEALAAAAAABAAEAAAICTAEAOw==)

Các container của Fesco. Ảnh: _Fesco_

Hai tàu container khác của Fesco với tổng sức chở hơn 2.000 TEU vẫn duy trì
khai thác tuyến FIL-W, qua đó bảo đảm nguồn cung chỗ ổn định hàng tuần. Ra mắt
từ năm 2023, tuyến dịch vụ này kết nối Novorossiysk với Nhava Sheva và Mundra
(Ấn Độ), cùng Jebel Ali (UAE) và Jeddah (Saudi Arabia).

Năm 2025, tuyến FIL-W vận chuyển hơn 19.000 TEU, tăng 16% so với cùng kỳ,
trong đó hàng xuất khẩu đạt khoảng 8.000 TEU và hàng nhập khẩu vượt 11.000
TEU.

Việc bổ sung công suất được kỳ vọng đáp ứng nhu cầu thương mại gia tăng giữa
Nga, Nam Á và Trung Đông, đồng thời cải thiện độ ổn định dịch vụ cho các chủ
hàng trên hành lang vận tải này.

Fesco Transport Group là tập đoàn vận tải và logistics có trụ sở tại Nga, được
thành lập năm 1880. Doanh nghiệp hoạt động trong các lĩnh vực vận tải biển,
đường sắt, cảng biển và dịch vụ hậu cần quốc tế. Fesco sở hữu đội tàu
container, hệ thống tàu hỏa và các trung tâm logistics phục vụ mạng lưới vận
tải đa phương thức. Tập đoàn đóng vai trò quan trọng trong kết nối thương mại
giữa Nga với châu Á và nhiều thị trường toàn cầu.

**Hải My**(_Theo_ _Maritime Gateway_)

",https://vnexpress.net/fesco-tang-gan-20-cong-suat-van-chuyen-tren-tuyen-an-do-nga-5040135.html
Nissan Gravite - MPV 7 chỗ giá từ 6.200 USD,Ấn ĐộMẫu xe đa dụng 7 chỗ của Nissan phát triển dựa trên mẫu Renault Triber nhưng mang vẻ hiện đại với kiểu dáng lai crossover.,"Thứ ba, 24/2/2026, 14:59 (GMT+7)",Chí Nguyên,"Sự khác biệt chính giữa Gravite và ""người anh em"" Triber đến từ những thay đổi
về thiết kế ngoại thất, giúp Gravite mang diện mạo riêng nhưng vẫn giữ nguyên
cấu trúc cơ bản.

Về ngoại thất, phần đầu xe Gravite được [Nissan](https://vnexpress.net/oto-xe-
may/v-car/hang-xe/nissan-24) làm mới với cản trước thiết kế lại và lưới tản
nhiệt họa tiết tổ ong lớn hơn, kết hợp các chi tiết khí động học, đèn LED ban
ngày làm mới và các yếu tố hình chữ C ngược, tạo ra nét khác biệt so với
Renault Triber.

Ngoài ra, Gravite trang bị bộ vành hợp kim thiết kế mới và bảng màu ngoại thất
có tùy chọn màu xanh lục lấy cảm hứng từ mẫu SUV Patrol. Cản sau cũng được tạo
hình lại và dòng chữ Gravite nổi bật trên nắp cốp, tạo điểm nhấn riêng cho
phiên bản của Nissan.

Nội thất của Gravite phần lớn được kế thừa từ Renault Triber. Mặc dù có chiều
dài chỉ ở mức 3.991 mm, mẫu xe này lại có bố trí ba hàng ghế, 7 chỗ. Hàng ghế
thứ ba là trang bị tiêu chuẩn, nhưng có thể tháo bỏ để tăng thể tích chứa đồ
lên tới 625 lít.

Trang bị tiêu chuẩn của Gravite bao gồm 6 túi khí, hệ thống giám sát áp suất
lốp, ESP, kiểm soát lực kéo, hỗ trợ khởi hành ngang dốc, hỗ trợ phanh, ABS,
EBD và cảm biến đỗ xe phía sau. Phiên bản Visia tiêu chuẩn đi kèm vành thép 14
inch và màn hình hiển thị đa thông tin 3,5 inch, trong khi phiên bản Acenta
cao cấp hơn được trang bị thêm ốp vành, cửa gió cho hàng ghế thứ hai và thứ ba
(điều khiển điều hòa cơ cho hàng ghế thứ hai), hệ thống thông tin giải trí màn
hình cảm ứng 8 inch (với Android Auto và Apple CarPlay không dây).

Phiên bản N-Connecta bổ sung giá nóc, đèn báo rẽ LED cho gương chiếu hậu, thêm
không gian chứa đồ (hộp đựng găng tay trên và dưới), camera lùi và bộ lọc
PM2.5. Phiên bản Tekna nâng cấp hơn với đèn pha LED, vành xe hai tông màu 15
inch, cụm đồng hồ kỹ thuật số 7 inch, hệ thống điều khiển hành trình (chỉ dành
cho bản số sàn) và bộ sạc không dây.

Phiên bản Tekna còn có gói trang bị Launch Edition bổ sung các chi tiết khí
động học hình chữ C, ốp vòm bánh xe, tem thân xe, tấm chắn mưa cửa và nhiều
chi tiết mạ crôm hơn.

Đối với những khách hàng muốn nhiều hơn nữa, danh mục phụ kiện bao gồm loa
JBL, camera hành trình kép, máy lọc không khí ngoài, đèn chiếu sáng nội thất.

Bên dưới nắp ca-pô là động cơ xăng hút khí tự nhiên 3 xi-lanh, dung tích 1.0,
sản sinh khoảng 71 mã lực và 96 Nm mô-men xoắn, đi kèm tùy chọn hộp số sàn 5
cấp hoặc hộp số tự động EZ-Shift. Đây không phải là cấu hình mạnh, nhưng phù
hợp với mục tiêu tiết kiệm nhiên liệu và chi phí vận hành thấp của mẫu xe này.

Với giá khởi điểm chỉ khoảng 6.200 USD, Gravite được định vị là một trong
những mẫu xe 7 chỗ giá hấp dẫn nhất Ấn Độ, nhằm thu hút những gia đình tìm
kiếm một chiếc MPV rộng rãi, thực dụng mà vẫn hợp túi tiền. Nissan cũng công
bố phiên bản đặc biệt Launch Edition với trang bị đầy đủ hơn, dự kiến có giá
cao hơn nhưng vẫn ở mức cạnh tranh.

**Chí Nguyên** (theo _Carscoops_)

",https://vnexpress.net/nissan-gravite-mpv-7-cho-gia-tu-6-200-usd-5043456.html
Trái tim xuyên Việt hồi sinh bé 11 tuổi,"Các bác sĩ Bệnh viện Đại học Y Dược TP HCM thực hiện thành công ca ghép tim từ một người hiến tại Hà Nội hồi sinh em bé 11 tuổi, rạng sáng mùng 7 Tết.","Thứ ba, 24/2/2026, 14:47 (GMT+7)",Mỹ Ý,"Đây là ca ghép tim thứ 9 từ người hiến chết não, tại Bệnh viện Đại học Y Dược
TP HCM. Bệnh nhi là bé trai 11 tuổi bị [suy tim](https://vnexpress.net/chu-
de/suy-tim-7147) giai đoạn cuối đang trong tình trạng nguy kịch.

Hành trình hồi sinh sự sống bắt đầu chiều mùng 6 Tết, khi bệnh viện nhận thông
tin từ Trung tâm Điều phối ghép tạng quốc gia về một trái tim hiến tặng tại
Bệnh viện Bạch Mai (Hà Nội), phù hợp với bé. Tình trạng người hiến không ổn
định, nếu kéo dài thời gian hồi sức chết não sẽ ảnh hưởng trực tiếp đến chất
lượng tạng. Thời gian cấp bách, đòi hỏi các êkíp liên quan phải vận hành với
tốc độ cao nhất.

Bệnh viện Đại học Y Dược TP HCM kích hoạt quy trình ghép tim khẩn cấp. Trong
vòng hơn một giờ, êkíp gồm các phẫu thuật viên tim mạch, bác sĩ gây mê hồi
sức, điều dưỡng và kỹ thuật viên đã tập trung đầy đủ và di chuyển ra Hà Nội
trên chuyến bay gần nhất. Lúc này, nhiều y bác sĩ đang trong kỳ nghỉ Tết hoặc
vừa trở lại thành phố đã chủ động nhận lệnh điều động, quay lại bệnh viện tham
gia ca ghép tim.

Trái tim người hiến được vận chuyển về đến TP HCM lúc 3h45 sáng mùng 7 Tết.
Tại phòng mổ, êkíp phẫu thuật đã chờ sẵn để tiến hành ca ghép. Một giờ sau,
trái tim đã đập lại trong lồng ngực em bé với những nhịp đập mạnh mẽ và đều
đặn.

Sau ghép, huyết động ổn định, bệnh nhi đang được theo dõi sát tại Khoa Hồi
sức.

![Các bác sĩ thực hiện ghép tim cho bệnh nhi. Ảnh: Bệnh viện cung
cấp](data:image/gif;base64,R0lGODlhAQABAAAAACH5BAEKAAEALAAAAAABAAEAAAICTAEAOw==)

Các bác sĩ phẫu thuật ghép tim cho bệnh nhi. Ảnh: _Bệnh viện cung cấp_

Đến nay, Bệnh viện Đại học Y Dược TP HCM đã thực hiện 214 ca ghép tạng, gồm 97
ca ghép thận, 108 ca ghép gan và 9 ca ghép tim.

**Mỹ Ý**

",https://vnexpress.net/trai-tim-xuyen-viet-hoi-sinh-be-11-tuoi-5043560.html
"Tưởng làm giàu từ cờ bạc, tôi trắng tay ngay sau lần đầu thắng","Tôi không vay tiền ai, cũng không nợ nần gì nhưng toàn bộ tiền tiết kiệm đã ""bay"" hết trong vòng hai năm.","Thứ ba, 24/2/2026, 14:41 (GMT+7)",Hoàng Nam,"Tôi 21 tuổi, biết đến tài xỉu online qua bạn bè; ban đầu chỉ nạp vài trăm
nghìn đồng kiểu chơi giải trí, nghĩ chắc không sao. Trong một tuần tôi thắng
được 15 triệu đồng, nghĩ mình sẽ làm giàu từ đây. Rồi chuyện gì đến cũng đến,
một buổi tối tôi thua sạch số tiền lời cũng như số vốn trước đó đã nạp. Tôi
càng đánh càng thua, thậm chí còn đánh to để gỡ, vì thế số tiền mất càng
nhiều.

![Tưởng làm giàu từ cờ bạc, tôi trắng tay ngay sau lần đầu
thắng](data:image/gif;base64,R0lGODlhAQABAAAAACH5BAEKAAEALAAAAAABAAEAAAICTAEAOw==)

Tôi đã mất 100 triệu đồng sau hai năm biết đến cờ bạc online. Tôi không vay
tiền ai, cũng không nợ nần gì nhưng đó là số tiền tiết kiệm được trong thời
gian đi làm, đã ""bay"" hết trong vòng hai năm. Thời gian qua tôi đi làm và sinh
hoạt như người mất hồn. Nhiều đêm tôi tự dằn vặt bản thân, có ý định làm điều
dại dột. Mong mọi người cho tôi lời khuyên để có thể vượt qua giai đoạn này.
Xin cảm ơn.

**Hoàng Nam**

",https://vnexpress.net/tuong-lam-giau-tu-co-bac-toi-trang-tay-ngay-sau-lan-dau-thang-5043546.html
"Con gái 13 tuổi cao 1,75 m của Hoa hậu Thùy Lâm","Bé Mon - 13 tuổi, con út của Hoa hậu Thùy Lâm - gây chú ý khán giả với chiều cao 1,75 m, vượt hơn mẹ.","Thứ ba, 24/2/2026, 14:40 (GMT+7)",Tân Cao,"Đầu năm, video bé Mon diện áo dài nhảy theo nhạc cùng mẹ thu hút người xem.
Nhiều bình luận nhận xét Mon thừa hưởng nhiều nét đẹp của Thùy Lâm.

![Con gái cao 1,75 m của Hoa hậu Thùy
Lâm](https://iv1cdn.vnecdn.net/giaitri/images/web/2026/02/24/con-gai-
cao-175-m-cua-hoa-hau-thuy-
lam-1771895702.jpg?w=0&h=0&q=100&dpr=1&fit=crop&s=yfI5Tf5RgiywZQV011cdRg)

Con gái cao 1,75 m của Hoa hậu Thùy Lâm

Hoa hậu Thùy Lâm, cao 1,7 m, và con gái mặc đồng điệu.

Hoa hậu cho rằng bé Mon cao lớn nhờ gen gia đình bởi bố cô bé cao 1,81 m. Con
trai đầu của Thùy Lâm - bé Su, 15 tuổi, cao hơn 1,85 m. Thùy Lâm cho biết một
trong những yếu tố quan trọng giúp con khỏe mạnh là chế độ dinh dưỡng, vận
động. Theo hoa hậu, hai con không kén ăn từ nhỏ, hợp cả đồ Âu lẫn Á. Ngoài ra,
Mon thích chơi nhiều môn thể thao. Ở tuổi 13, bé được mẹ khen ngoan, vâng lời
bố mẹ và biết tự lập.

![Thùy Lâm bên con gái trong cuộc sống đời
thường.](data:image/gif;base64,R0lGODlhAQABAAAAACH5BAEKAAEALAAAAAABAAEAAAICTAEAOw==)

Thùy Lâm bên con gái trong cuộc sống đời thường hồi đầu năm.

Khoảng hai năm trở lại đây, hoa hậu Thùy Lâm thường chia sẻ hình ảnh của con
với công chúng, cùng Mon quay video về cuộc sống đời thường để bé dạn dĩ hơn.
Thùy Lâm cho biết hiện hai mẹ con có thể mặc chung size quần áo với nhau.

![Hoa hậu Thùy Lâm và con gái quay thử thách đổi trang phục cho
nhau](https://iv1cdn.vnecdn.net/giaitri/images/web/2026/02/24/hoa-hau-thuy-
lam-va-con-gai-quay-thu-thach-doi-trang-phuc-
ch-1771896239.webp?w=0&h=0&q=100&dpr=1&fit=crop&s=C9E88K35s_-glG796Wk-Rw)

Hoa hậu Thùy Lâm và con gái quay thử thách đổi trang phục cho nhau

Hoa hậu Thùy Lâm và con gái quay thử thách đổi trang phục cho nhau

Hoa hậu tên đầy đủ Nguyễn Thùy Lâm, 39 tuổi, sinh ra và lớn lên ở TP HCM. Cô
[đăng quang](https://vnexpress.net/ca-si-thuy-lam-dang-quang-hoa-hau-hoan-vu-
vn-1896844.html) Hoa hậu Hoàn vũ Việt Nam 2008, sau đó vào top 15 Miss
Universe tổ chức cùng năm. Người đẹp từng tham gia nhiều lĩnh vực nghệ thuật
như phim ảnh, âm nhạc, thời trang. Người đẹp được khán giả nhớ đến qua các
phim _Tây Sơn hào kiệt_ , _Kiều nữ và đại gia, Tấm hộ chiếu vào đời, Ghen,_
hay phát hành CD _Thùy Lâm 18._

![Con gái Thùy Lâm khi còn
nhỏ.](data:image/gif;base64,R0lGODlhAQABAAAAACH5BAEKAAEALAAAAAABAAEAAAICTAEAOw==)

Con gái Thùy Lâm khi còn nhỏ (trái), và hình ảnh tổ ấm nhỏ của hoa hậu.

Giữa đỉnh cao sự nghiệp, cô [kết hôn](https://vnexpress.net/hoa-hau-thuy-lam-
cuoi-tien-si-kinh-te-1906133.html) với tiến sĩ kinh tế Nguyễn Anh Tuấn vào năm
2009, rồi rút lui khỏi các hoạt động giải trí. Thùy Lâm nói hài lòng về cuộc
sống hôn nhân. Thỉnh thoảng, cô và ông xã hẹn hò riêng như đi câu cá, du lịch.
Người đẹp còn rủ chồng quay các video vui nhộn, hút sự quan tâm của công
chúng. Hiện cô tập trung thời gian cho công việc kinh doanh, vun vén tổ ấm
nhỏ.

![Thùy Lâm nói về cuộc sống hôn
nhân](https://iv1cdn.vnecdn.net/giaitri/images/web/2026/02/24/thuy-lam-noi-ve-
cuoc-song-hon-
nhan-1771896744.jpg?w=0&h=0&q=100&dpr=1&fit=crop&s=fUTj_jo6Sr4nb8ghshlcbQ)

Thùy Lâm nói về cuộc sống hôn nhân

Thùy Lâm nói về cuộc sống hôn nhân.

**Tân Cao**  
Ảnh, video: _Nhân vật cung cấp_

",https://vnexpress.net/con-gai-13-tuoi-cao-1-75-m-cua-hoa-hau-thuy-lam-5043323.html
