title,short_description,publish_time,author,markdown_content,url
"Hoại tử xương đùi, người đàn ông phải thay khớp háng","TP HCMÔng Phượng, 49 tuổi, đau khớp háng lan đến thắt lưng, đầu gối, bác sĩ chẩn đoán hoại tử chỏm xương đùi, chỉ định thay khớp háng.","Thứ ba, 24/2/2026, 14:00 (GMT+7)",Phi Hồng,"Kết quả chụp MRI tại Phòng khám Đa khoa Tâm Anh Quận 7 ghi nhận ông Phượng bị
hoại tử chỏm xương đùi giai đoạn muộn ở khớp háng trái, vỡ xương dưới sụn, làm
xẹp chỏm xương đùi, gây đau nhiều và ảnh hưởng khả năng vận động. ThS.BS.CKI
Trương Hữu Bảo, Trưởng chuyên khoa Chấn thương Chỉnh hình, cho biết phẫu thuật
thay khớp háng toàn phần là phương pháp điều trị phù hợp với người bệnh.

Bác sĩ chỉ định mổ bằng kỹ thuật SPAIRE ít xâm lấn, tiếp cận từ phía sau giúp
bảo tồn nhóm cơ xoay ngoài, hạn chế tối đa tổn thương gân cơ và các mô mềm
khác. Nhờ đó, người bệnh ít mất máu, ít đau, phục hồi sau mổ nhanh hơn và giảm
đáng kể nguy cơ trật khớp sau này. Ông Phượng được thay khớp háng nhân tạo
loại ceramic on ceramic, trong đó cả ổ cối và chỏm xương đùi đều làm bằng vật
liệu sứ. Loại khớp này có tính tương thích sinh học cao, ít gây kích ứng, độ
bền tốt, khả năng mài mòn thấp, tuổi thọ có thể trên 25 năm.

![Bác sĩ Bảo \(trái\) phẫu thuật cho ông Phượng. Ảnh: Bệnh viện Đa khoa Tâm
Anh](data:image/gif;base64,R0lGODlhAQABAAAAACH5BAEKAAEALAAAAAABAAEAAAICTAEAOw==)

Bác sĩ Bảo (trái) phẫu thuật cho ông Phượng. Ảnh: _Bệnh viện Đa khoa Tâm Anh_

Bác sĩ rạch một đường khoảng 6 cm ở mặt sau đùi trái, vén các cơ sang hai bên
và tiếp cận khớp háng, loại bỏ xương, sụn và các thành phần đã bị tổn thương
khác, thay khớp nhân tạo vào. Vén cơ thay cho cắt nhóm gân cơ xoay ngoài giúp
giữ khớp háng của người bệnh không bị trật sau mổ.

Ngày đầu sau mổ, ông Phượng gần như không còn đau và có thể tập [vật lý trị
liệu](https://vnexpress.net/tap-vat-ly-tri-lieu-co-het-thoat-vi-dia-dem-
khong-4808611.html), sức khỏe phục hồi tốt, xuất viện vào ngày tiếp theo.

![Bác sĩ Bảo thăm hỏi người bệnh trước khi xuất viện. Ảnh: Bệnh viện Đa khoa
Tâm
Anh](data:image/gif;base64,R0lGODlhAQABAAAAACH5BAEKAAEALAAAAAABAAEAAAICTAEAOw==)

Bác sĩ Bảo thăm hỏi người bệnh trước khi xuất viện. Ảnh: _Bệnh viện Đa khoa
Tâm Anh_

Bác sĩ Bảo cho biết hoại tử chỏm xương đùi xảy ra do thiếu máu nuôi dưỡng, dẫn
đến hoại tử xương và sụn. Nếu không được phát hiện và điều trị kịp thời, người
bệnh có thể đối mặt với nguy cơ mất khả năng đi lại, ảnh hưởng đến chức năng
cột sống, gây biến dạng hình dáng cơ thể... Bệnh thường xảy ra ở nam giới và
có xu hướng gia tăng theo tuổi tác.

Hoại tử chỏm xương đùi không có triệu chứng rõ ràng giai đoạn đầu, khi xuất
hiện các dấu hiệu bất thường, bệnh đã chuyển nặng. Cơn đau trở nên rõ rệt,
xuất hiện ở mặt trước vùng bẹn lan xuống đùi, đau nhiều hơn khi vận động, đứng
lâu và giảm khi nghỉ ngơi, tầm vận động hạn chế, khó thực hiện các động tác
xoay trong, xoay ngoài, dạng hoặc khép chân và gần như không thể ngồi xổm.

Lúc này, người bệnh có thể được phẫu thuật [thay khớp
háng](https://vnexpress.net/nguoi-cao-tuoi-gay-co-xuong-dui-co-nen-thay-khop-
hang-4991575.html). Hiện có nhiều kỹ thuật mổ hiện đại, ít xâm lấn giúp người
bệnh nhanh chóng đi lại và xuất viện như đường mổ phía trước ngoài ABMS, đường
mổ SuperPATH, Anterior Path, SPAIRE, đường mổ trước trực tiếp...

**Phi Hồng**

",https://vnexpress.net/hoai-tu-xuong-dui-nguoi-dan-ong-phai-thay-khop-hang-5043543.html
6 món quen thuộc đốt mỡ gan,"Tăng cường rau xanh, trái cây, thực phẩm giàu chất xơ, đồng thời hạn chế đường bổ sung và chất béo chuyển hóa, giúp giảm tích tụ mỡ trong gan.","Thứ ba, 24/2/2026, 14:00 (GMT+7)",Quả bơ,"![](https://vcdn1-suckhoe.vnecdn.net/2026/02/24/386516844-1488340948588692-287-5890-9098-1732803267-1771904397-1771904408-1771904426-1771904682.jpg?w=220&h=0&q=80&dpr=1&fit=crop&s=-itFUDKiFLhyuX4uRAyWdg)

[](javascript:;) [](javascript:;) [](javascript:;)

**Quả bơ**

Bơ giàu chất béo tốt, hỗ trợ sức khỏe tim mạch và gan. Loại quả này chứa các
chất hóa học, axit béo lành mạnh có thể làm chậm quá trình tổn thương gan,
giảm tình trạng viêm.

Nhiều người chọn bơ kết hợp trong bữa ăn sáng và tối nhằm tăng cảm giác no,
hạn chế lượng calo nạp vào, từ đó kiểm soát cân nặng tốt hơn. Bạn có thể ăn
100 g bơ, 2-3 lần mỗi tuần trong chế độ ăn cân đối để tăng cường sức khỏe.

**Quả bơ**

Bơ giàu chất béo tốt, hỗ trợ sức khỏe tim mạch và gan. Loại quả này chứa các
chất hóa học, axit béo lành mạnh có thể làm chậm quá trình tổn thương gan,
giảm tình trạng viêm.

Nhiều người chọn bơ kết hợp trong bữa ăn sáng và tối nhằm tăng cảm giác no,
hạn chế lượng calo nạp vào, từ đó kiểm soát cân nặng tốt hơn. Bạn có thể ăn
100 g bơ, 2-3 lần mỗi tuần trong chế độ ăn cân đối để tăng cường sức khỏe.

![](https://vcdn1-suckhoe.vnecdn.net/2026/02/24/448761077-1175135677242516-2107012414547922988-n-1771904448.jpg?w=220&h=0&q=80&dpr=1&fit=crop&s=geFJ0mQQwnHZvH099UjJHQ)

[](javascript:;) [](javascript:;) [](javascript:;)

**Cá**

Các loại cá đều chứa hàm lượng protein dồi dào, góp phần giảm tiêu thụ chất
béo và da từ thịt hoặc gia cầm, phòng ngừa bệnh gan nhiễm mỡ. Cá béo như cá
hồi, cá mòi, cá ngừ giàu axit béo omega-3, làm giảm lượng mỡ trong gan và giảm
viêm, cải thiện gan nhiễm mỡ.

**Cá**

Các loại cá đều chứa hàm lượng protein dồi dào, góp phần giảm tiêu thụ chất
béo và da từ thịt hoặc gia cầm, phòng ngừa bệnh gan nhiễm mỡ. Cá béo như cá
hồi, cá mòi, cá ngừ giàu axit béo omega-3, làm giảm lượng mỡ trong gan và giảm
viêm, cải thiện gan nhiễm mỡ.

![](https://vcdn1-suckhoe.vnecdn.net/2026/02/24/Buoc-1-1-1875-1700469362-1771904498.jpg?w=220&h=0&q=80&dpr=1&fit=crop&s=H0JMeqE3MSTcwbYrj3_8cw)

[](javascript:;) [](javascript:;) [](javascript:;)

**Rau xanh**

Rau bina, cải Brussels và nhiều rau lá xanh khác giàu nitrat tự nhiên và
polyphenol góp phần hạn chế tích tụ mỡ trong gan. Hàm lượng chất xơ dồi dào
giúp tăng cảm giác no, hỗ trợ kiểm soát cân nặng và giảm nguy cơ tích mỡ nội
tạng. Chất xơ trong rau xanh còn có tác dụng cải thiện mức cholesterol trong
máu, tốt cho sức khỏe tim mạch.

**Rau xanh**

Rau bina, cải Brussels và nhiều rau lá xanh khác giàu nitrat tự nhiên và
polyphenol góp phần hạn chế tích tụ mỡ trong gan. Hàm lượng chất xơ dồi dào
giúp tăng cảm giác no, hỗ trợ kiểm soát cân nặng và giảm nguy cơ tích mỡ nội
tạng. Chất xơ trong rau xanh còn có tác dụng cải thiện mức cholesterol trong
máu, tốt cho sức khỏe tim mạch.

![](data:image/gif;base64,R0lGODlhAQABAAAAACH5BAEKAAEALAAAAAABAAEAAAICTAEAOw==)

[](javascript:;) [](javascript:;) [](javascript:;)

**Đậu nành**

Tàu hũ hay đậu nành đều giúp phòng bệnh gan nhiễm mỡ không do rượu (NAFLD) vì
chứa triglyceride có thể giảm tích tụ mỡ nội tạng. Chúng giàu dinh dưỡng, tinh
bột kháng có thể cải thiện sức khỏe đường ruột. Ăn 2-3 bữa đậu mỗi tuần hỗ trợ
giảm lượng đường trong máu và triglyceride ở người béo phì.

**Đậu nành**

Tàu hũ hay đậu nành đều giúp phòng bệnh gan nhiễm mỡ không do rượu (NAFLD) vì
chứa triglyceride có thể giảm tích tụ mỡ nội tạng. Chúng giàu dinh dưỡng, tinh
bột kháng có thể cải thiện sức khỏe đường ruột. Ăn 2-3 bữa đậu mỗi tuần hỗ trợ
giảm lượng đường trong máu và triglyceride ở người béo phì.

![](data:image/gif;base64,R0lGODlhAQABAAAAACH5BAEKAAEALAAAAAABAAEAAAICTAEAOw==)

[](javascript:;) [](javascript:;) [](javascript:;)

**Hạt óc chó**

Người bệnh gan nhiễm mỡ nên chuẩn bị hạt óc chó trong túi xách hoặc ở bàn làm
việc để nhâm nhi 3-4 hạt mỗi khi đói hoặc làm đồ ăn nhẹ. Loại hạt này nhiều
axit béo omega-3 có tác dụng giảm viêm. Bạn có thể thêm vào món xào để tăng
thêm độ giòn hoặc rắc lên món salad. Mỗi ngày không nên ăn quá một nắm tay hạt
óc chó vì làm dư thừa calo.

**Hạt óc chó**

Người bệnh gan nhiễm mỡ nên chuẩn bị hạt óc chó trong túi xách hoặc ở bàn làm
việc để nhâm nhi 3-4 hạt mỗi khi đói hoặc làm đồ ăn nhẹ. Loại hạt này nhiều
axit béo omega-3 có tác dụng giảm viêm. Bạn có thể thêm vào món xào để tăng
thêm độ giòn hoặc rắc lên món salad. Mỗi ngày không nên ăn quá một nắm tay hạt
óc chó vì làm dư thừa calo.

![](data:image/gif;base64,R0lGODlhAQABAAAAACH5BAEKAAEALAAAAAABAAEAAAICTAEAOw==)

[](javascript:;) [](javascript:;) [](javascript:;)

**Hạt hướng dương**

Vitamin E trong hạt hướng dương là chất chống oxy hóa mạnh mẽ có thể bảo vệ
gan khỏi tổn thương. Ăn hạt này trực tiếp hoặc rắc lên salad dùng làm món ăn
nhẹ mỗi ngày giúp tăng thêm độ giòn ngon, béo ngậy. Bạn có thể ăn hạt hướng
dương mỗi ngày nhưng không nên dùng quá một nắm tay.

**Hạt hướng dương**

Vitamin E trong hạt hướng dương là chất chống oxy hóa mạnh mẽ có thể bảo vệ
gan khỏi tổn thương. Ăn hạt này trực tiếp hoặc rắc lên salad dùng làm món ăn
nhẹ mỗi ngày giúp tăng thêm độ giòn ngon, béo ngậy. Bạn có thể ăn hạt hướng
dương mỗi ngày nhưng không nên dùng quá một nắm tay.

**Anh Chi**(Theo _Healthline, WebMD, Healthshots_)  
_Ảnh:_**Bảo Bảo, Anh Chi, Bùi Thủy**

Độc giả đặt câu hỏi về bệnh tiêu hóa [tại đây](https://vnexpress.net/suc-
khoe/cac-benh/benh-tieu-hoa/hoi-dap) để bác sĩ giải đáp  
---

",https://vnexpress.net/6-mon-quen-thuoc-dot-mo-gan-5043457.html
Ôn Bích Hà theo mốt bra-top,Minh tinh Hong Kong Ôn Bích Hà tôn vóc dáng với bra-top trong chuyến du xuân.,"Thứ ba, 24/2/2026, 13:54 (GMT+7)",Như Anh,"![](https://vcdn1-giaitri.vnecdn.net/2026/02/24/ha2-1771913618.jpg?w=220&h=0&q=80&dpr=1&fit=crop&s=pLdGkIWwgk-
LiTMr9VEHKQ)

[](javascript:;) [](javascript:;) [](javascript:;)

Theo _HK01_ , dịp Tết âm lịch năm nay, diễn viên và chồng - doanh nhân Hà Tổ
Quang - nghỉ dưỡng ở đảo Bali, Indonesia. Cô mời gia đình một số nhân viên du
lịch chung, mọi chi phí do Ôn Bích Hà chi trả.

Theo _HK01_ , dịp Tết âm lịch năm nay, diễn viên và chồng - doanh nhân Hà Tổ
Quang - nghỉ dưỡng ở đảo Bali, Indonesia. Cô mời gia đình một số nhân viên du
lịch chung, mọi chi phí do Ôn Bích Hà chi trả.

![](https://vcdn1-giaitri.vnecdn.net/2026/02/24/ha1-1771913617.jpg?w=220&h=0&q=80&dpr=1&fit=crop&s=fzGDdmQwEjm56zNDxu8AfA)

[](javascript:;) [](javascript:;) [](javascript:;)

Minh tinh 60 tuổi diện áo tắm vải dệt kim, đính hoa. Phần áo được cô biến tấu,
mặc như bra-top, kết hợp với chân váy dài.

Minh tinh 60 tuổi diện áo tắm vải dệt kim, đính hoa. Phần áo được cô biến tấu,
mặc như bra-top, kết hợp với chân váy dài.

![](https://vcdn1-giaitri.vnecdn.net/2026/02/24/ha4-1771913619.jpg?w=220&h=0&q=80&dpr=1&fit=crop&s=zEz8_QSwz9aWpiU_wY0PTg)

[](javascript:;) [](javascript:;) [](javascript:;)

Ôn Bích Hà cho biết thích đến nơi nắng ấm mỗi kỳ nghỉ vì sợ lạnh.

Ôn Bích Hà cho biết thích đến nơi nắng ấm mỗi kỳ nghỉ vì sợ lạnh.

![](data:image/gif;base64,R0lGODlhAQABAAAAACH5BAEKAAEALAAAAAABAAEAAAICTAEAOw==)

[](javascript:;) [](javascript:;) [](javascript:;)

Người đẹp khoe vóc dáng với mẫu bikini buộc dây màu nổi bật.

Người đẹp khoe vóc dáng với mẫu bikini buộc dây màu nổi bật.

![](data:image/gif;base64,R0lGODlhAQABAAAAACH5BAEKAAEALAAAAAABAAEAAAICTAEAOw==)

[](javascript:;) [](javascript:;) [](javascript:;)

Diễn viên duy trì vòng eo gần 60 cm. Nếu không quá bận, hàng ngày Ôn Bích Hà
tập yoga hai tiếng để rèn vóc dáng. Cô tiết lộ thuộc dạng dễ mập, vì thế chăm
chạy máy, leo núi để tránh tăng cân.

Diễn viên duy trì vòng eo gần 60 cm. Nếu không quá bận, hàng ngày Ôn Bích Hà
tập yoga hai tiếng để rèn vóc dáng. Cô tiết lộ thuộc dạng dễ mập, vì thế chăm
chạy máy, leo núi để tránh tăng cân.

![](data:image/gif;base64,R0lGODlhAQABAAAAACH5BAEKAAEALAAAAAABAAEAAAICTAEAOw==)

[](javascript:;) [](javascript:;) [](javascript:;)

Diễn viên và chồng - Hà Tổ Quang, họ tổ chức tiệc trên bãi biển hôm Valentine
(14/2).

Diễn viên và chồng - Hà Tổ Quang, họ tổ chức tiệc trên bãi biển hôm Valentine
(14/2).

![](data:image/gif;base64,R0lGODlhAQABAAAAACH5BAEKAAEALAAAAAABAAEAAAICTAEAOw==)

[](javascript:;) [](javascript:;) [](javascript:;)

Vợ chồng gắn bó 26 năm, có con trai nuôi năm nay 16 tuổi.

Vợ chồng gắn bó 26 năm, có con trai nuôi năm nay 16 tuổi.

![Ôn Bích Hà trong 'Đát Kỷ Trụ
Vương'](https://iv1cdn.vnecdn.net/giaitri/images/web/2022/05/13/on-bich-ha-
trong-dat-ky-tru-
vuong-1652439357.jpg?w=0&h=0&q=100&dpr=1&fit=crop&s=92W38PVnw9kPUEPSTcoPCQ)

Ôn Bích Hà trong 'Đát Kỷ Trụ Vương'

Ôn Bích Hà trong _Đát Kỷ - Trụ Vương_. Video: _TVB_

![](data:image/gif;base64,R0lGODlhAQABAAAAACH5BAEKAAEALAAAAAABAAEAAAICTAEAOw==)

[](javascript:;) [](javascript:;) [](javascript:;)

Ôn Bích Hà gia nhập làng giải trí thập niên 1980, được mệnh danh biểu tượng
gợi cảm Hong Kong. Cô nổi tiếng qua vai Đát Kỷ trong _[Đát Kỷ - Trụ
Vương](https://vnexpress.net/dan-sao-dat-ky-tru-vuong-
sau-21-nam-4463042.html), Bông hồng lửa, Mối hận Kim Bình, Biến động kinh
hồn_. Những năm gần đây, người đẹp đóng _Đọa lạc hoa, Tuổi 18 của chúng ta._

Ngoài đóng phim, [Ôn Bích Hà](https://vnexpress.net/chu-de/on-bich-ha-4795)
kinh doanh thương hiệu quần áo cô thành lập, tự làm mẫu cho các thiết kế. Cô
còn là blogger về làm đẹp, thường quay video về phối đồ, trang điểm, các sản
phẩm thời trang.

Ôn Bích Hà gia nhập làng giải trí thập niên 1980, được mệnh danh biểu tượng
gợi cảm Hong Kong. Cô nổi tiếng qua vai Đát Kỷ trong _[Đát Kỷ - Trụ
Vương](https://vnexpress.net/dan-sao-dat-ky-tru-vuong-
sau-21-nam-4463042.html), Bông hồng lửa, Mối hận Kim Bình, Biến động kinh
hồn_. Những năm gần đây, người đẹp đóng _Đọa lạc hoa, Tuổi 18 của chúng ta._

Ngoài đóng phim, [Ôn Bích Hà](https://vnexpress.net/chu-de/on-bich-ha-4795)
kinh doanh thương hiệu quần áo cô thành lập, tự làm mẫu cho các thiết kế. Cô
còn là blogger về làm đẹp, thường quay video về phối đồ, trang điểm, các sản
phẩm thời trang.

**Như Anh**  
Ảnh: _Weibo_

",https://vnexpress.net/on-bich-ha-theo-mot-bra-top-5043536.html
Dịch vụ vệ sinh ôtô quá tải sau Tết,"TP HCMNhu cầu chăm sóc ôtô tăng cao, trong khi nhiều tiệm chưa hoạt động hoặc thiếu nhân lực, khiến chủ xe chờ nhiều giờ hoặc cả ngày.","Thứ ba, 24/2/2026, 13:42 (GMT+7)",Phạm Trung,"Thành Nhân trở lại TP HCM hôm 23/2 (mùng 7) sau quãng nghỉ Tết về quê cùng gia
đình bằng ôtô. Chỉ trong buổi sáng cùng ngày, anh cho biết di chuyển đến 4
xưởng vệ sinh ôtô, có nơi chưa, có nơi hoạt động lại thì chỗ nào cũng quá tải.
Nhân viên các xưởng báo phải chờ nhiều giờ hoặc để lại xe, khi nào đến lượt sẽ
liên lạc.

Tại một xưởng vệ sinh, chăm sóc xe ở phường Gò Vấp, anh Văn Huyến, một tài xế
công nghệ nói chờ hơn một giờ để rửa ngoại thất, xịt gầm, hút bụi chiếc xe 5
chỗ để chở khách trở lại sau Tết. Anh nói đi từ sáng sớm, sau 2 điểm rửa xe
quá tải thì đến điểm thứ ba mới được sắp xếp xe vào bên trong và thời gian chờ
chấp nhận được.

![Dàn xe chờ rửa, vệ sinh nội thất sau Tết tại một xưởng ở TP HCM sáng 23/2
\(mùng 7 Tết\). Ảnh: Phạm
Trung](data:image/gif;base64,R0lGODlhAQABAAAAACH5BAEKAAEALAAAAAABAAEAAAICTAEAOw==)

Dàn xe chờ rửa, vệ sinh nội thất sau Tết tại một xưởng ở TP HCM sáng 23/2
(mùng 7 Tết). Ảnh: _Phạm Trung_

Chị Thảo Vân, chủ một cơ sở chăm sóc xe ở phường Thủ Đức cho biết, ngày thường
nơi đây tiếp nhận khoảng 20 xe thì sau Tết gấp 2-3 lần. Tình trạng quá tải ở
các tiệm rửa xe chủ yếu do một số nơi chưa hoạt động vì họ muốn ""lấy ngày""
khai trương may mắn. Nhân lực cũng chưa đủ vì một số người chưa trở lại thành
phố.

Trong ngày mùng 7, nhân viên của xưởng chị Vân làm việc liên tục đến 22 giờ,
trong khi thường ngày chỉ đến 16-17 giờ là xưởng đã nghỉ. Nhiều chủ xe chấp
nhận để xe lại qua đêm để kịp rửa sớm vào hôm sau.

Hầu hết các cơ sở chăm sóc xe đều trở lại giá dịch vụ của ngày thường. Một số
nơi tăng nhẹ nhưng không đáng kể, khoảng 10.000-20.000 đồng tùy hạng mục.

Nhu cầu phổ biến nhất sau những ngày Tết là rửa và hút bụi nội thất. Giá cho
hai dịch vụ này dao động 90.000-150.000 đồng tùy loại xe và số chỗ. Với vệ
sinh, chăm sóc nội thất, giá dao động khoảng vài trăm nghìn đến hơn một triệu
đồng.

Theo một số chủ cơ sở chăm sóc xe, tình trạng quá tải này còn diễn ra trong ít
ngày tới khi ôtô ở tỉnh tiếp tục trở lại thành phố hoặc nhiều chủ xe ở thành
phố không sử dụng xe trong Tết muốn vệ sinh để đi lại. Sau đó, lượng khách tấp
nập sẽ giảm và về mức bình thường khi các xưởng hoạt động đông đủ trở lại.

Tại Việt Nam, mỗi dịp Tết với quãng nghỉ dài, ôtô thường di chuyển nhiều và
liên tục. Các chuyên gia chăm sóc xe khuyến cáo, ngoài các hạng mục cơ bản như
vệ sinh nội, ngoại thất, chủ xe cần kiểm tra thêm tình trạng phanh, lốp để bảo
dưỡng kịp thời. Bên cạnh đó là các loại dầu phanh, dầu động cơ, nước làm mát
hoặc nước rửa kính.

Với những ôtô để lâu không sử dụng, chủ xe cần lưu ý tình trạng của ắc quy, áp
suất lốp hay khoang máy. Việc kiểm tra tổng thể xe, phát hiện và xử lý kịp
thời các hư hỏng giúp xe vận hành ổn định và an toàn hơn.

**Phạm Trung**

",https://vnexpress.net/dich-vu-ve-sinh-oto-qua-tai-sau-tet-5043354.html
"Nhiều người không biết câu tục ngữ này, còn bạn?",Câu tục ngữ là kinh nghiệm dân gian đúc kết thời điểm tốt nhất để trồng các loại cây.,"Thứ ba, 24/2/2026, 13:20 (GMT+7)",>> Đáp án,"Nhìn qua thì tưởng chỉ là hai chậu cây ""chăm chỉ lớn lên"", nhưng soi kỹ lại
thấy có gì đó sai sai.

Một bên là tháng Giêng, cây tre vươn thẳng, xanh mướt đầy sức sống. Bên còn
lại là tháng Sáu, cây hồ tiêu cũng chẳng kém cạnh, leo cao, ra dáng ""có tương
lai"". Cả hai đều được nâng niu, chăm sóc kỹ càng như nhau, nhìn thôi cũng thấy
yêu đời liền.

![Nhiều người không biết câu tục ngữ này, còn
bạn?](data:image/gif;base64,R0lGODlhAQABAAAAACH5BAEKAAEALAAAAAABAAEAAAICTAEAOw==)

Nhưng khoan... hai mốc thời gian này ghép lại nghe quen quen đúng không? Có vẻ
như đây không chỉ là chuyện trồng cây, mà là một ""ẩn dụ nhẹ"" về cuộc sống.
Kiểu như nhắc khéo: làm gì thì cũng phải đúng thời điểm, đúng mùa vụ. Chứ
trồng sai thời, dù chăm kỹ cỡ nào thì cũng hơi... ""toang"".

Bức ảnh này đúng chuẩn đố vui cuối ngày: nhẹ đầu, dễ thương mà vẫn khiến não
phải hoạt động xíu xiu. Thôi thì thử đoán xem, câu tục ngữ nào đang ""ẩn mình""
sau hai chậu cây này nhé!

[**> > Đáp án**](https://vnexpress.net/Duoi-hinh-bat-chu-thanh-ngu-tuc-ngu-
nhieu-nguoi-khong-biet-cau-tuc-ngu-nay-con-ban-5043463-p2.html "">> Đáp án"")

**Mộc Trà**

",https://vnexpress.net/duoi-hinh-bat-chu-thanh-ngu-tuc-ngu-nhieu-nguoi-khong-biet-cau-tuc-ngu-nay-con-ban-5043463.html
